{
  "id": "rhythm-of-war",
  "title": "Rhythm of War",
  "series": "stormlight",
  "order": 4,
  "published": 2020,
  "wordCount": 467000,
  "summary": "The occupation of Urithiru by the Fused forces of Odium forces the Radiants to wage a desperate guerrilla war within their own fortress. Kaladin, stripped of his Stormlight and bonded to a dying Syl, must protect the wounded spren of the Tower while confronting the deep trauma that has haunted him since his first battle. Navani Kholin, imprisoned alongside the scholars of Urithiru, discovers revolutionary secrets about the nature of Light—Anti-Stormlight, Towerlight, and the fundamental vibrations that underlie all investiture—as she works alongside the brilliant Fused scholar Raboniel. Shallan, Adolin, and their allies venture into the deadly expanse of Shadesmar to prevent the Sibling—the ancient spren of Urithiru—from being destroyed. The science of Roshar reaches a turning point as characters grapple with depression, collaboration with the enemy, and the question of whether peace is possible between humans and singers.",
  "cover": "images/covers/rhythm_of_war.webp",
  "volumeNumber": "ROS-004",
  "classification": "PRIMARY ACCESSION · SCHOLARLY ACCESSION",
  "archiveDescription": "This volume departs from the battlefield chronicle to focus on the scientific and psychological dimensions of the Rosharan conflict. The occupation of Urithiru by Fused forces provides the framework for a detailed examination of investiture theory, including the discovery of anti-Stormlight and the vibrational nature of all Cosmere magic. The record follows a scholar's collaboration with an enemy researcher, documenting breakthroughs in the understanding of Light, tone, and rhythm. Concurrently, it examines the psychological trauma of prolonged warfare through the experience of a Radiant stripped of his powers. This volume represents a significant advancement in Cosmere scientific knowledge."
}
