{
  "id": "the-bands-of-mourning",
  "title": "The Bands of Mourning",
  "series": "mistborn-era-2",
  "order": 3,
  "published": 2016,
  "wordCount": 126000,
  "summary": "Wax travels north beyond the borders of the Elendel Basin to the frontier city of New Seran in search of the Bands of Mourning—legendary metalminds said to contain the combined Allomantic and Feruchemical powers of the Survivor himself. Joined by Wayne, Marasi, and the unexpected Steris—whose meticulous planning proves invaluable—Wax uncovers technology created by the Lord Ruler himself and discovers secrets that challenge everything Scadrial knows about the origins of its magic. Beyond the mountains, an ancient temple holds answers about the true nature of the Sovereign, and the threat from beyond the Cosmere grows ever closer.",
  "cover": "images/covers/the_bands_of_mourning.webp",
  "volumeNumber": "SCR-006",
  "classification": "PRIMARY ACCESSION · SECULAR RECORD",
  "archiveDescription": "An expedition beyond the known borders of the Elendel Basin provides the framework for this record, which expands the geographical and historical understanding of Scadrial. The search for legendary metalminds—reputed to contain the combined powers of the Survivor—leads to discoveries about the Lord Ruler's technological innovations and the true extent of his preparation for future threats. This volume also documents the first substantial contact with artifacts and knowledge originating from outside the Scadrian system, marking a significant expansion in the Cosmere's interconnected history."
}
