{
  "id": "white-sand-vol-2",
  "title": "White Sand Vol. 2",
  "series": "white-sand",
  "order": 2,
  "published": 2018,
  "wordCount": 15000,
  "summary": "Kenton continues his struggle to rebuild the Diem as the political factions of Lossand vie for control of the sand masters. The discovery of a massive, unnatural sandstorm approaching Dayside threatens everyone, while the mysterious Trackers—agents of the Darkside—close in on their objectives. Khriss and her expedition venture into the treacherous Deep Desert in search of answers about the Sand Lord, the origin of sand mastery, and the connection between Taldain and the wider Cosmere. Alliances shift, secrets are uncovered, and Kenton must decide whether tradition or adaptation will save his people.",
  "cover": "images/covers/white_sand_vol_2.webp",
  "volumeNumber": "TAL-002",
  "classification": "PRIMARY ACCESSION · CULTURAL SURVEY",
  "archiveDescription": "This second Taldain volume continues the documentation of Lossand's political struggles as surviving sand masters attempt to rebuild their order. The record expands to include the Deep Desert and the mysterious forces that dwell within it, as well as the arrival of agents from the Darkside whose objectives remain unclear. The off-world scholar's investigations deepen, revealing connections between Taldain's investiture and the fundamental principles that govern the Cosmere. The volume documents the tension between preservation of tradition and adaptation to changing circumstances."
}
