{
  "id": "shadows-of-self",
  "title": "Shadows of Self",
  "series": "mistborn-era-2",
  "order": 2,
  "published": 2015,
  "wordCount": 114000,
  "summary": "The city of Elendel faces a rising tide of chaos as Waxillium Ladrian is called upon to protect the descendants of the Survivor from a threat born of the city's own founding. A series of brutal murders leads Wax and Wayne to uncover a conspiracy involving an enigmatic figure from Scadrial's past—someone who should be long dead. As riots erupt and Harmony's plans remain frustratingly opaque, Wax must confront the limits of his faith in the god who guides him. Marasi Colms, a law student and capable Mistborn in her own right, proves that she is far more than a damsel in distress as she digs deeper into the mysteries of the Set.",
  "cover": "images/covers/shadows_of_self.webp",
  "volumeNumber": "SCR-005",
  "classification": "PRIMARY ACCESSION · SECULAR RECORD",
  "archiveDescription": "This volume records the destabilization of Elendel's political order as a figure from Scadrial's distant past reemerges in the industrial age. The investigation into a series of ritualistic murders reveals the extent to which Shardic influence continues to shape mortal destinies, even in an era of secular progress. The document examines the tension between technological advancement and the persistent influence of investiture-based phenomena, as well as the growing awareness among Scadrian scholars of a broader cosmological context beyond their world."
}
