{
  "id": "the-well-of-ascension",
  "title": "The Well of Ascension",
  "series": "mistborn-era-1",
  "order": 2,
  "published": 2007,
  "wordCount": 248000,
  "summary": "In the year following the Lord Ruler's fall, the newly free city of Luthadel faces chaos on multiple fronts. Three armies converge on the capital: one led by Elend Venture's ruthless father Straff, one by the mysterious invader from the East, and one commanded by a creature of legend made flesh. Vin and Elend struggle to forge a functional government while investigating the Well of Ascension—an ancient source of power said to grant god-like abilities to whoever claims it. Meanwhile, a force deep beneath the city stirs, whispering promises of relief from an ancient burden, and the line between preservation and destruction grows dangerously thin.",
  "cover": "images/covers/the_well_of_ascension.webp",
  "volumeNumber": "SCR-002",
  "classification": "PRIMARY ACCESSION · SECULAR RECORD",
  "archiveDescription": "In the immediate aftermath of the Lord Ruler's fall, this record examines the fragile transition of power in Luthadel and the chaos that followed the sudden vacuum of authority. Multiple military forces converge on the capital while the young monarch Elend Venture attempts to establish a constitutional government. The investigation into the Well of Ascension—an ancient repository of investiture beneath the city—reveals the deeper schism between Preservation and Ruin that underpins Scadrial's very existence. This volume is essential for scholars studying post-collapse societal reconstruction and the nature of Shardic influence on mortal affairs."
}
