{
  "id": "yumi-and-the-nightmare-painter",
  "title": "Yumi and the Nightmare Painter",
  "series": "secret-projects",
  "order": 2,
  "published": 2023,
  "wordCount": 120000,
  "summary": "On the twin worlds of Komashi, Yumi is a revered yoki-hijo who summons benevolent spirits to stack stones into intricate towers for her people—a life of ritual, duty, and isolation. Nikaro, known as Painter, is a loner in a futuristic city who paints nightmares—terrifying entities born of human fear—to trap them before they can harm anyone. When a mysterious force swaps their bodies across worlds, they must learn to inhabit each other's lives and skills to survive. Told through Hoid's framing narrative to his friend Design, this story explores art, purpose, and the beauty of finding connection across the boundaries of culture, class, and reality itself.",
  "cover": "images/covers/yumi_and_the_nightmare_painter.webp",
  "volumeNumber": "SP-002",
  "classification": "EXCEPTIONAL ACCESSION · FIELD REPORT",
  "archiveDescription": "This record concerns the twin worlds of Komashi, presented through a framing narrative of uncertain provenance. The volume documents a unique investiture phenomenon wherein one individual summons spirits to construct stone towers through ritual, while another binds nightmares—entities of concentrated human fear—through the medium of paint. The temporary merging of these two individuals across worlds provides unprecedented insight into the relationship between investiture, perception, and the boundaries that separate planetary systems. The scholarly value of this accession lies in its documentation of investiture systems that diverge significantly from previously catalogued patterns."
}
